{
  "allowed_paths": {
    "aggregate-stair-1-flight-1": [
      "/attributes"
    ],
    "aggregate-stair-2-flight-2": [
      "/attributes"
    ],
    "slab-ground": [
      "/materials"
    ],
    "slab-roof": [
      "/materials"
    ],
    "slab-storey-2": [
      "/materials"
    ],
    "slab-storey-3": [
      "/materials"
    ],
    "stair-1": [
      "/attributes"
    ],
    "stair-2": [
      "/attributes"
    ],
    "stair-flight-1": [
      "/attributes"
    ],
    "stair-flight-2": [
      "/attributes"
    ],
    "wall-storey-1-storey-1-wall-east": [
      "/materials"
    ],
    "wall-storey-1-storey-1-wall-north": [
      "/materials"
    ],
    "wall-storey-1-storey-1-wall-partition": [
      "/materials"
    ],
    "wall-storey-1-storey-1-wall-south": [
      "/materials"
    ],
    "wall-storey-1-storey-1-wall-west": [
      "/materials"
    ],
    "wall-storey-2-storey-2-wall-east": [
      "/materials"
    ],
    "wall-storey-2-storey-2-wall-north": [
      "/materials"
    ],
    "wall-storey-2-storey-2-wall-partition": [
      "/materials"
    ],
    "wall-storey-2-storey-2-wall-south": [
      "/materials"
    ],
    "wall-storey-2-storey-2-wall-west": [
      "/materials"
    ],
    "wall-storey-3-storey-3-wall-east": [
      "/materials"
    ],
    "wall-storey-3-storey-3-wall-north": [
      "/materials"
    ],
    "wall-storey-3-storey-3-wall-partition": [
      "/materials"
    ],
    "wall-storey-3-storey-3-wall-south": [
      "/materials"
    ],
    "wall-storey-3-storey-3-wall-west": [
      "/materials"
    ]
  },
  "base_revision_id": "revision-00",
  "dependencies": [
    {
      "dependency_id": "aggregate-stair-1-flight-1",
      "reason": "IfcRelAggregates references an allowed component.",
      "relationship_type": "IfcRelAggregates",
      "target_id": "stair-1"
    },
    {
      "dependency_id": "aggregate-stair-2-flight-2",
      "reason": "IfcRelAggregates references an allowed component.",
      "relationship_type": "IfcRelAggregates",
      "target_id": "stair-2"
    }
  ],
  "entity_ids": [
    "slab-ground",
    "slab-roof",
    "slab-storey-2",
    "slab-storey-3",
    "stair-1",
    "stair-2",
    "stair-flight-1",
    "stair-flight-2",
    "wall-storey-1-storey-1-wall-east",
    "wall-storey-1-storey-1-wall-north",
    "wall-storey-1-storey-1-wall-partition",
    "wall-storey-1-storey-1-wall-south",
    "wall-storey-1-storey-1-wall-west",
    "wall-storey-2-storey-2-wall-east",
    "wall-storey-2-storey-2-wall-north",
    "wall-storey-2-storey-2-wall-partition",
    "wall-storey-2-storey-2-wall-south",
    "wall-storey-2-storey-2-wall-west",
    "wall-storey-3-storey-3-wall-east",
    "wall-storey-3-storey-3-wall-north",
    "wall-storey-3-storey-3-wall-partition",
    "wall-storey-3-storey-3-wall-south",
    "wall-storey-3-storey-3-wall-west"
  ],
  "forbidden_ids": [
    "building-1",
    "door-storey-1-storey-1-door-entrance-south",
    "door-storey-1-storey-1-door-partition",
    "door-storey-2-storey-2-door-partition",
    "door-storey-3-storey-3-door-partition",
    "fill-door-storey-1-storey-1-door-entrance-south",
    "fill-door-storey-1-storey-1-door-partition",
    "fill-door-storey-2-storey-2-door-partition",
    "fill-door-storey-3-storey-3-door-partition",
    "fill-window-storey-1-storey-1-window-east",
    "fill-window-storey-1-storey-1-window-north",
    "fill-window-storey-1-storey-1-window-south-1",
    "fill-window-storey-1-storey-1-window-south-2",
    "fill-window-storey-1-storey-1-window-west",
    "fill-window-storey-2-storey-2-window-east",
    "fill-window-storey-2-storey-2-window-north",
    "fill-window-storey-2-storey-2-window-south-1",
    "fill-window-storey-2-storey-2-window-south-2",
    "fill-window-storey-2-storey-2-window-west",
    "fill-window-storey-3-storey-3-window-east",
    "fill-window-storey-3-storey-3-window-north",
    "fill-window-storey-3-storey-3-window-south-1",
    "fill-window-storey-3-storey-3-window-south-2",
    "fill-window-storey-3-storey-3-window-west",
    "opening-door-storey-1-storey-1-door-entrance-south",
    "opening-door-storey-1-storey-1-door-partition",
    "opening-door-storey-2-storey-2-door-partition",
    "opening-door-storey-3-storey-3-door-partition",
    "opening-storey-2-slab-stair",
    "opening-storey-3-slab-stair",
    "opening-window-storey-1-storey-1-window-east",
    "opening-window-storey-1-storey-1-window-north",
    "opening-window-storey-1-storey-1-window-south-1",
    "opening-window-storey-1-storey-1-window-south-2",
    "opening-window-storey-1-storey-1-window-west",
    "opening-window-storey-2-storey-2-window-east",
    "opening-window-storey-2-storey-2-window-north",
    "opening-window-storey-2-storey-2-window-south-1",
    "opening-window-storey-2-storey-2-window-south-2",
    "opening-window-storey-2-storey-2-window-west",
    "opening-window-storey-3-storey-3-window-east",
    "opening-window-storey-3-storey-3-window-north",
    "opening-window-storey-3-storey-3-window-south-1",
    "opening-window-storey-3-storey-3-window-south-2",
    "opening-window-storey-3-storey-3-window-west",
    "project-1",
    "site-1",
    "space-storey-1-storey-1-space-hall",
    "space-storey-1-storey-1-space-stairwell",
    "space-storey-2-storey-2-space-hall",
    "space-storey-2-storey-2-space-landing-north",
    "space-storey-3-storey-3-space-hall",
    "space-storey-3-storey-3-space-landing-south",
    "storey-1",
    "storey-2",
    "storey-3",
    "void-opening-door-storey-1-storey-1-door-entrance-south",
    "void-opening-door-storey-1-storey-1-door-partition",
    "void-opening-door-storey-2-storey-2-door-partition",
    "void-opening-door-storey-3-storey-3-door-partition",
    "void-opening-storey-2-slab-stair",
    "void-opening-storey-3-slab-stair",
    "void-opening-window-storey-1-storey-1-window-east",
    "void-opening-window-storey-1-storey-1-window-north",
    "void-opening-window-storey-1-storey-1-window-south-1",
    "void-opening-window-storey-1-storey-1-window-south-2",
    "void-opening-window-storey-1-storey-1-window-west",
    "void-opening-window-storey-2-storey-2-window-east",
    "void-opening-window-storey-2-storey-2-window-north",
    "void-opening-window-storey-2-storey-2-window-south-1",
    "void-opening-window-storey-2-storey-2-window-south-2",
    "void-opening-window-storey-2-storey-2-window-west",
    "void-opening-window-storey-3-storey-3-window-east",
    "void-opening-window-storey-3-storey-3-window-north",
    "void-opening-window-storey-3-storey-3-window-south-1",
    "void-opening-window-storey-3-storey-3-window-south-2",
    "void-opening-window-storey-3-storey-3-window-west",
    "window-storey-1-storey-1-window-east",
    "window-storey-1-storey-1-window-north",
    "window-storey-1-storey-1-window-south-1",
    "window-storey-1-storey-1-window-south-2",
    "window-storey-1-storey-1-window-west",
    "window-storey-2-storey-2-window-east",
    "window-storey-2-storey-2-window-north",
    "window-storey-2-storey-2-window-south-1",
    "window-storey-2-storey-2-window-south-2",
    "window-storey-2-storey-2-window-west",
    "window-storey-3-storey-3-window-east",
    "window-storey-3-storey-3-window-north",
    "window-storey-3-storey-3-window-south-1",
    "window-storey-3-storey-3-window-south-2",
    "window-storey-3-storey-3-window-west"
  ],
  "relationship_ids": [
    "aggregate-stair-1-flight-1",
    "aggregate-stair-2-flight-2"
  ],
  "schema_version": "text2ifc/change-scope/1.0",
  "scope_id": "scope-revision-01",
  "source_issue_ids": [
    "issue_audit_0001_01",
    "issue_audit_0001_02",
    "issue_audit_0001_03",
    "issue_audit_0001_04",
    "issue_deterministic_gate_0001",
    "issue_deterministic_gate_0002",
    "issue_deterministic_gate_0003",
    "issue_deterministic_gate_0004",
    "issue_deterministic_gate_0005",
    "issue_deterministic_gate_0006",
    "issue_deterministic_gate_0007",
    "issue_deterministic_gate_0008",
    "issue_deterministic_gate_0009",
    "issue_deterministic_gate_0010",
    "issue_deterministic_gate_0011",
    "issue_deterministic_gate_0012",
    "issue_deterministic_gate_0013",
    "issue_deterministic_gate_0014",
    "issue_deterministic_gate_0015",
    "issue_deterministic_gate_0016",
    "issue_deterministic_gate_0017",
    "issue_deterministic_gate_0018",
    "issue_deterministic_gate_0019",
    "issue_deterministic_gate_0020",
    "issue_deterministic_gate_0021",
    "issue_deterministic_gate_0022",
    "issue_deterministic_gate_0023",
    "issue_deterministic_gate_0024",
    "issue_deterministic_gate_0025",
    "issue_deterministic_gate_0026",
    "issue_deterministic_gate_0027",
    "issue_deterministic_gate_0028",
    "issue_deterministic_gate_0029",
    "issue_deterministic_gate_0030",
    "issue_deterministic_gate_0031",
    "issue_deterministic_gate_0032",
    "issue_deterministic_gate_0033",
    "issue_deterministic_gate_0034",
    "issue_deterministic_gate_0035",
    "issue_deterministic_gate_0036",
    "issue_deterministic_gate_0037",
    "issue_deterministic_gate_0038"
  ]
}
